{
  "id": "88888888-8888-4888-8888-888888888888",
  "organizationId": "11111111-1111-4111-8111-111111111111",
  "workItemId": "66666666-6666-4666-8666-666666666666",
  "authorId": "22222222-2222-4222-8222-222222222222",
  "body": "Reviewed the contract baseline; ready to move to In Progress.",
  "visibility": "project",
  "createdAt": "2026-07-16T09:20:00Z"
}
